PubmedID,Title,Publication Date,Non-academic Author(s),Company Affiliation(s),Corresponding Author Email
40600230,Molecular Insights into Gastric Cancer: A Comparative Analysis of Asian and White Populations.,2025,Roy Khalife,"Protean BioDiagnostics, Orlando, FL, U.S.A.",Not found
40599346,Clinical landscape for patients with head and neck cancers enrolled in phase I trials at a tertiary referral center.,2025,Alexandro Paccapelo,"Research and Innovation Unit, IRCCS Azienda Ospedaliero-Universitaria di Bologna, Bologna, Italy.",Not found
40599321,Spatial transcriptomic analysis of immune checkpoint blockade response in triple negative breast cancers with tertiary lymphoid structures.,2025,Sandra Demaria,"Radiation Oncology, Weill Cornell Medicine, New York, NY, USA.",Not found
40598933,Covalent Targeting Leads to the Development of a LIMK1 Isoform-Selective Inhibitor.,2025,Niall Prendiville; María Baena-Nuevo; Ana Corrionero; Patricia Alfonso,"Enzymlogic, Qube Technology Park, C/Santiago Grisolía, 2, 28760 Madrid, Spain.",Not found
40598513,Targeted-theranostic nanoparticles induce anti-tumor immune response in lung cancer.,2025,Fabien Rossetti; Eder Jose Guidelli; Mileni Isikawa; Sandrine Dufort; Olivier Tillement; François Lux,"NH TherAguix SA, Meylan, 38240, France.; Université Claude Bernard Lyon 1, CNRS, Institut Lumière Matière, Villeurbanne, 69100, France.; Departamento de Física-Faculdade de Filosofia, Ciências e Letras de Ribeirão Preto, Universidade de São Paulo, Ribeirão Preto, São Paulo, 14040- 901, Brazil.",Not found
40598415,Aurantio-obtusin modulates Wilms Tumour 1 within the breast tumour microenvironment reducing immunosuppression and tumour growth.,2025,Paul G Loftus; Stephen J Elliman,"Orbsen Therapeutics Ltd., Galway Business Park, Galway, Ireland.",Not found
40598348,CAR-T cells targeting CCR9 and CD1a for the treatment of T cell acute lymphoblastic leukemia.,2025,María José Mansilla; Alba Garcia-Perez; Juan Alcain; Marina García-Peydró; Europa Azucena González; Jordi Minguillón; Antonio Pérez-Martínez; Manuel Ramírez-Orellana; Víctor M Díaz; María L Toribio,"Red Española de Terapias Avanzadas (TERAV+), Instituto de Salud Carlos III, Madrid, Spain.; OneChain Immunotherapeutics S.L, Barcelona, Spain.; Centro de Biología Molecular Severo Ochoa CSIC-UAM, Madrid, Spain.; Centro de Biología Molecular Severo Ochoa CSIC-UAM, Madrid, Spain. mtoribio@cbm.csic.es.",mtoribio@cbm.csic.es.
40597849,"Exploring what matters most to patients in relapsed refractory multiple myeloma treatment: a Canadian discrete choice experiment with patients, caregivers and physicians.",2025,Rebekah Hall; Gin Nie Chua; Bonnie Macfarlane; Richard K Plante; Kun Shi; Stephanie Soltys; Martine Elias; Jessy Ranger,"Johnson & Johnson, Ottawa, Canada.; Acaster Lloyd Consulting Ltd, London, UK.; Myeloma Canada, Dorval, Canada.; Independent Researcher, Ottawa, Canada.; Acaster Lloyd Consulting Ltd, London, UK. rebekah.hall@acasterlloyd.com.",rebekah.hall@acasterlloyd.com.
40597707,A scoping review of human papillomavirus related data system in China.,2025,Ruixuan Wang; Jun Zhang; Ya-Ting Chen; Wei Wang,"MSD R&D (China) Co., Ltd, Beijing, 110105, China.; Value & Implementation Outcome Research Merck & Co., Inc, 126 East Lincoln Avenue, P.O. Box 2000, Rahway, NJ, 07065, USA.; Value & Implementation Outcome Research Merck & Co., Inc, 126 East Lincoln Avenue, P.O. Box 2000, Rahway, NJ, 07065, USA. wei.wang40@merck.com.",wei.wang40@merck.com.
40597177,Faecalibacterium prausnitzii promotes anti-PD-L1 efficacy in natural killer/T-cell lymphoma by enhancing antitumor immunity.,2025,Hongwen Li,"Lymphoma Diagnosis and Treatment Centre of Henan Province, Zhengzhou, 450052, Henan, China.",Not found
40596656,Prognostic and immunotherapeutic significance of NCAPD2 in pan-cancer and its role in hepatocellular carcinoma progression via the AKT/GSK-3β signaling pathway.,2025,Yao Tian,"Qilu Pharmaceutical Co., Ltd, Jinan, 250100, China.",Not found
40595293,Macrophages foster anti-tumor immunity by ZEB1-dependent cytotoxic T cell chemoattraction.,2025,Christoph Becker,"Deutsches Zentrum Immuntherapie (DZI), Erlangen, Germany.",Not found
40594568,General practitioners' recommendation of HPV vaccination to adolescents aged 11-14 may be gender-biased as suggested by a qualitative study in France.,2025,Laura X Gil Sánchez; Charlotte Bauquier; Thomas Bujon; Marie Préau; Patricia Villain,"Unité Inserm 1296 « Radiations : Défense, Santé, Environnement », Université Lumière Lyon 2 Institut de Psychologie, Lyon, France.; Early Detection, Prevention, and Infections (EPR) Branch, International Agency for Research on Cancer (IARC), World Health Organization (IARC - WHO), Lyon, France.; Département d'Études Politiques et Territoriales , Université Jean Monet , Saint-Étienne, France.; Early Detection, Prevention, and Infections (EPR) Branch, International Agency for Research on Cancer (IARC), World Health Organization (IARC - WHO), Lyon, France. patriciavillain1@gmail.com.",patriciavillain1@gmail.com.
